{
  "schema": "finding.v2",
  "id": "demo.finding.pairing.exceeds",
  "fact_id": "tax.us.2025.identity-association.acquisition-to-box1|left=DEMO-BOND-EXCEED,right=demo.1099int-statement.associated",
  "value": {
    "left_fact_id": "tax.us.obligation-acquisition-circumstance|payer=demo.payer.bank-a,reference=DEMO-BOND-EXCEED,acquisition-year=2025",
    "right_fact_id": "tax.us.2025.f1099int.box1-interest|payer=demo.payer.bank-a,statement=demo.1099int-statement.associated,tax-year=2025"
  },
  "basis": "attested",
  "evidence_ids": ["demo.evidence.pairing.exceeds"]
}
